{"aggregate":{"entry_count":91,"entry_manifest_sha256":"dbf015ad7ff4211cdb4a6fa311a66abc0b540026b502ab9c3eca2b7d487b6b86","selected_bytes":223452511},"entries":[{"filename":"aiodns-3.5.0-py3-none-any.whl","name":"aiodns","requires_python":">=3.9","selected_tag":"py3-none-any","sha256":"6d0404f7d5215849233f6ee44854f2bb2481adf71b336b2279016ea5990ca5c5","size":8068,"version":"3.5.0","wheel_tags":["py3-none-any"]},{"filename":"aiohappyeyeballs-2.6.1-py3-none-any.whl","name":"aiohappyeyeballs","requires_python":">=3.9","selected_tag":"py3-none-any","sha256":"f349ba8f4b75cb25c99c5c2d84e997e485204d2902a9597802b0371f09331fb8","size":15265,"version":"2.6.1","wheel_tags":["py3-none-any"]},{"filename":"aiohttp-3.13.0-cp312-cp312-manylinux_2_17_x86_64.whl","name":"aiohttp","requires_python":">=3.9","selected_tag":"cp312-cp312-manylinux_2_17_x86_64","sha256":"2e66c57416352f36bf98f6641ddadd47c93740a22af7150d3e9a1ef6e983f9a8","size":1750379,"version":"3.13.0","wheel_tags":["cp312-cp312-manylinux_2_17_x86_64","cp312-cp312-manylinux2014_x86_64","cp312-cp312-manylinux_2_28_x86_64"]},{"filename":"aiosignal-1.4.0-py3-none-any.whl","name":"aiosignal","requires_python":">=3.9","selected_tag":"py3-none-any","sha256":"053243f8b92b990551949e63930a839ff0cf0b0ebbe0597b0f3fb19e1a0fe82e","size":7490,"version":"1.4.0","wheel_tags":["py3-none-any"]},{"filename":"alpaca_py-0.42.1-py3-none-any.whl","name":"alpaca-py","requires_python":">=3.8.0,<4.0.0","selected_tag":"py3-none-any","sha256":"234fea37151d4d5995de6d4f2fff24d584120214eb9f39198c399d1000004efa","size":122157,"version":"0.42.1","wheel_tags":["py3-none-any"]},{"filename":"annotated_types-0.7.0-py3-none-any.whl","name":"annotated-types","requires_python":">=3.8","selected_tag":"py3-none-any","sha256":"1f02e8b43a8fbbc3f3e0d4f0f4bfc8131bcb4eebe8849b8e5c773f3a1c582a53","size":13643,"version":"0.7.0","wheel_tags":["py3-none-any"]},{"filename":"anyio-4.10.0-py3-none-any.whl","name":"anyio","requires_python":">=3.9","selected_tag":"py3-none-any","sha256":"60e474ac86736bbfd6f210f7a61218939c318f43f9972497381f1c5e930ed3d1","size":107213,"version":"4.10.0","wheel_tags":["py3-none-any"]},{"filename":"attrs-25.4.0-py3-none-any.whl","name":"attrs","requires_python":">=3.9","selected_tag":"py3-none-any","sha256":"adcf7e2a1fb3b36ac48d97835bb6d8ade15b8dcce26aba8bf1d14847b57a3373","size":67615,"version":"25.4.0","wheel_tags":["py3-none-any"]},{"filename":"backoff-2.2.1-py3-none-any.whl","name":"backoff","requires_python":">=3.7,<4.0","selected_tag":"py3-none-any","sha256":"63579f9a0628e06278f7e47b7d7d5b6ce20dc65c5e96a6f3ca99a6adca0396e8","size":15148,"version":"2.2.1","wheel_tags":["py3-none-any"]},{"filename":"beautifulsoup4-4.13.5-py3-none-any.whl","name":"beautifulsoup4","requires_python":">=3.7.0","selected_tag":"py3-none-any","sha256":"642085eaa22233aceadff9c69651bc51e8bf3f874fb6d7104ece2beb24b47c4a","size":105113,"version":"4.13.5","wheel_tags":["py3-none-any"]},{"filename":"ccxt-4.5.8-py3-none-any.whl","name":"ccxt","requires_python":null,"selected_tag":"py3-none-any","sha256":"0a30aab9cd1c2787c611fd2de50d7a04785941454fc01e57dc920eec6ef42342","size":5797608,"version":"4.5.8","wheel_tags":["py2-none-any","py3-none-any"]},{"filename":"certifi-2025.8.3-py3-none-any.whl","name":"certifi","requires_python":">=3.7","selected_tag":"py3-none-any","sha256":"f6c12493cfb1b06ba2ff328595af9350c65d6644968e5d3a2ffd78699af217a5","size":161216,"version":"2025.8.3","wheel_tags":["py3-none-any"]},{"filename":"cffi-2.0.0-cp312-cp312-manylinux_2_17_x86_64.whl","name":"cffi","requires_python":">=3.9","selected_tag":"cp312-cp312-manylinux_2_17_x86_64","sha256":"3e17ed538242334bf70832644a32a7aae3d83b57567f9fd60a26257e992b79ba","size":219572,"version":"2.0.0","wheel_tags":["cp312-cp312-manylinux_2_17_x86_64","cp312-cp312-manylinux2014_x86_64"]},{"filename":"charset_normalizer-3.4.3-cp312-cp312-manylinux_2_17_x86_64.whl","name":"charset-normalizer","requires_python":">=3.7","selected_tag":"cp312-cp312-manylinux_2_17_x86_64","sha256":"1606f4a55c0fd363d754049cdf400175ee96c992b1f8018b993941f221221c5f","size":151830,"version":"3.4.3","wheel_tags":["cp312-cp312-manylinux_2_17_x86_64","cp312-cp312-manylinux2014_x86_64","cp312-cp312-manylinux_2_28_x86_64"]},{"filename":"click-8.1.8-py3-none-any.whl","name":"click","requires_python":">=3.7","selected_tag":"py3-none-any","sha256":"63c132bbbed01578a06712a2d1f497bb62d9c1c0d329b7903a866228027263b2","size":98188,"version":"8.1.8","wheel_tags":["py3-none-any"]},{"filename":"coinbase_advanced_py-1.8.4-py3-none-any.whl","name":"coinbase-advanced-py","requires_python":">=3.8","selected_tag":"py3-none-any","sha256":"25488c2bb8452ffa54319804253f3b4d0dc346498a6fb24ef0e88c4fd91def3d","size":75315,"version":"1.8.4","wheel_tags":["py3-none-any"]},{"filename":"contourpy-1.3.3-cp312-cp312-manylinux_2_27_x86_64.whl","name":"contourpy","requires_python":">=3.11","selected_tag":"cp312-cp312-manylinux_2_27_x86_64","sha256":"4d00e655fcef08aba35ec9610536bfe90267d7ab5ba944f7032549c55a146da1","size":362601,"version":"1.3.3","wheel_tags":["cp312-cp312-manylinux_2_27_x86_64","cp312-cp312-manylinux_2_28_x86_64"]},{"filename":"coverage-7.10.6-cp312-cp312-manylinux_2_5_x86_64.whl","name":"coverage","requires_python":">=3.9","selected_tag":"cp312-cp312-manylinux_2_5_x86_64","sha256":"961834e2f2b863a0e14260a9a273aff07ff7818ab6e66d2addf5628590c628f9","size":251802,"version":"7.10.6","wheel_tags":["cp312-cp312-manylinux_2_5_x86_64","cp312-cp312-manylinux1_x86_64","cp312-cp312-manylinux_2_28_x86_64"]},{"filename":"cryptography-46.0.2-cp311-abi3-manylinux_2_34_x86_64.whl","name":"cryptography","requires_python":">=3.8, !=3.9.0, !=3.9.1","selected_tag":"cp311-abi3-manylinux_2_34_x86_64","sha256":"be939b99d4e091eec9a2bcf41aaf8f351f312cd19ff74b5c83480f08a8a43e0b","size":4482088,"version":"46.0.2","wheel_tags":["cp311-abi3-manylinux_2_34_x86_64"]},{"filename":"curl_cffi-0.13.0-cp39-abi3-manylinux_2_17_x86_64.whl","name":"curl-cffi","requires_python":">=3.9","selected_tag":"cp39-abi3-manylinux_2_17_x86_64","sha256":"8eb4083371bbb94e9470d782de235fb5268bf43520de020c9e5e6be8f395443f","size":8328585,"version":"0.13.0","wheel_tags":["cp39-abi3-manylinux_2_17_x86_64","cp39-abi3-manylinux2014_x86_64"]},{"filename":"cycler-0.12.1-py3-none-any.whl","name":"cycler","requires_python":">=3.8","selected_tag":"py3-none-any","sha256":"85cef7cff222d8644161529808465972e51340599459b8ac3ccbac5a854e0d30","size":8321,"version":"0.12.1","wheel_tags":["py3-none-any"]},{"filename":"eventkit-1.0.3-py3-none-any.whl","name":"eventkit","requires_python":null,"selected_tag":"py3-none-any","sha256":"0e199527a89aff9d195b9671ad45d2cc9f79ecda0900de8ecfb4c864d67ad6a2","size":31837,"version":"1.0.3","wheel_tags":["py3-none-any"]},{"filename":"fastapi-0.116.2-py3-none-any.whl","name":"fastapi","requires_python":">=3.8","selected_tag":"py3-none-any","sha256":"c3a7a8fb830b05f7e087d920e0d786ca1fc9892eb4e9a84b227be4c1bc7569db","size":95670,"version":"0.116.2","wheel_tags":["py3-none-any"]},{"filename":"fonttools-4.60.0-cp312-cp312-manylinux_2_5_x86_64.whl","name":"fonttools","requires_python":">=3.9","selected_tag":"cp312-cp312-manylinux_2_5_x86_64","sha256":"d3638905d3d77ac8791127ce181f7cb434f37e4204d8b2e31b8f1e154320b41f","size":4922729,"version":"4.60.0","wheel_tags":["cp312-cp312-manylinux_2_5_x86_64","cp312-cp312-manylinux1_x86_64","cp312-cp312-manylinux_2_17_x86_64","cp312-cp312-manylinux2014_x86_64"]},{"filename":"frozendict-2.4.6-py312-none-any.whl","name":"frozendict","requires_python":">=3.6","selected_tag":"py312-none-any","sha256":"49344abe90fb75f0f9fdefe6d4ef6d4894e640fadab71f11009d52ad97f370b9","size":16146,"version":"2.4.6","wheel_tags":["py312-none-any"]},{"filename":"frozenlist-1.8.0-cp312-cp312-manylinux_2_5_x86_64.whl","name":"frozenlist","requires_python":">=3.9","selected_tag":"cp312-cp312-manylinux_2_5_x86_64","sha256":"494a5952b1c597ba44e0e78113a7266e656b9794eec897b19ead706bd7074383","size":242411,"version":"1.8.0","wheel_tags":["cp312-cp312-manylinux_2_5_x86_64","cp312-cp312-manylinux1_x86_64","cp312-cp312-manylinux_2_28_x86_64"]},{"filename":"greenlet-3.2.4-cp312-cp312-manylinux_2_24_x86_64.whl","name":"greenlet","requires_python":">=3.9","selected_tag":"cp312-cp312-manylinux_2_24_x86_64","sha256":"3b3812d8d0c9579967815af437d96623f45c0f2ae5f04e366de62a12d83a8fb0","size":607586,"version":"3.2.4","wheel_tags":["cp312-cp312-manylinux_2_24_x86_64","cp312-cp312-manylinux_2_28_x86_64"]},{"filename":"h11-0.16.0-py3-none-any.whl","name":"h11","requires_python":">=3.8","selected_tag":"py3-none-any","sha256":"63cf8bbe7522de3bf65932fda1d9c2772064ffb3dae62d55932da54b31cb6c86","size":37515,"version":"0.16.0","wheel_tags":["py3-none-any"]},{"filename":"httpcore-1.0.9-py3-none-any.whl","name":"httpcore","requires_python":">=3.8","selected_tag":"py3-none-any","sha256":"2d400746a40668fc9dec9810239072b40b4484b640a8c38fd654a024c7a1bf55","size":78784,"version":"1.0.9","wheel_tags":["py3-none-any"]},{"filename":"httpx-0.28.1-py3-none-any.whl","name":"httpx","requires_python":">=3.8","selected_tag":"py3-none-any","sha256":"d909fcccc110f8c7faf814ca82a9a4d816bc5a6dbfea25d6591d6985b8ba59ad","size":73517,"version":"0.28.1","wheel_tags":["py3-none-any"]},{"filename":"ib_insync-0.9.86-py3-none-any.whl","name":"ib-insync","requires_python":">=3.6","selected_tag":"py3-none-any","sha256":"a61fbe56ff405d93d211dad8238d7300de76dd6399eafc04c320470edec9a4a4","size":72980,"version":"0.9.86","wheel_tags":["py3-none-any"]},{"filename":"idna-3.10-py3-none-any.whl","name":"idna","requires_python":">=3.6","selected_tag":"py3-none-any","sha256":"946d195a0d259cbba61165e88e65941f16e9b36ea6ddb97f00452bae8b1287d3","size":70442,"version":"3.10","wheel_tags":["py3-none-any"]},{"filename":"iniconfig-2.1.0-py3-none-any.whl","name":"iniconfig","requires_python":">=3.8","selected_tag":"py3-none-any","sha256":"9deba5723312380e77435581c6bf4935c94cbfab9b1ed33ef8d238ea168eb760","size":6050,"version":"2.1.0","wheel_tags":["py3-none-any"]},{"filename":"kiwisolver-1.4.9-cp312-cp312-manylinu